{
  "coverage": {
    "completed": [
      "pdf.actions",
      "pdf.annotations",
      "pdf.embedded_files",
      "pdf.form_fields",
      "pdf.metadata",
      "pdf.structure",
      "pdf.text_layer"
    ],
    "failed": [],
    "skipped": []
  },
  "durationMs": 0,
  "findings": [
    {
      "category": "hidden_text",
      "certainty": "deterministic",
      "detector": {
        "id": "pdf.text_layer",
        "version": "1.1.0"
      },
      "evidence": {
        "displayValue": "I***.",
        "maskPolicy": "text_keep_edges",
        "redacted": true
      },
      "group": "document_structure",
      "id": "finding-1",
      "location": {
        "kind": "pdf_text_layer",
        "page": 1
      },
      "message": "hidden_text found in pdf_text_layer",
      "remediation": {
        "supported": false,
        "unsupportedReason": "not_implemented"
      },
      "severity": "high"
    }
  ],
  "input": {
    "mediaType": "application/pdf",
    "path": "/fixtures/pdf/files/invisible-text.positive.pdf",
    "sha256": "799fe054b1f0f46a6dc93db5f684cf252939a60b663c0dd337edbd36ebfe7536",
    "sizeBytes": 684
  },
  "limitations": [],
  "runId": "01J00000000000000000000020",
  "schemaVersion": "1.1",
  "startedAt": "2026-01-01T00:00:00Z",
  "status": "review_required",
  "versions": {
    "core": "0.1.0",
    "detectors": [
      {
        "id": "pdf.actions",
        "version": "1.0.0"
      },
      {
        "id": "pdf.annotations",
        "version": "1.0.0"
      },
      {
        "id": "pdf.embedded_files",
        "version": "1.0.0"
      },
      {
        "id": "pdf.form_fields",
        "version": "1.0.0"
      },
      {
        "id": "pdf.metadata",
        "version": "1.1.0"
      },
      {
        "id": "pdf.structure",
        "version": "1.0.0"
      },
      {
        "id": "pdf.text_layer",
        "version": "1.1.0"
      }
    ],
    "parsers": [
      {
        "id": "pdf.parser",
        "version": "1.0.0"
      }
    ]
  }
}
