{
  "coverage": {
    "completed": [
      "pdf.actions",
      "pdf.annotations",
      "pdf.embedded_files",
      "pdf.form_fields",
      "pdf.metadata",
      "pdf.structure",
      "pdf.text_layer"
    ],
    "failed": [],
    "skipped": []
  },
  "durationMs": 0,
  "findings": [],
  "input": {
    "mediaType": "application/pdf",
    "path": "/fixtures/pdf/files/image-only-page.control.pdf",
    "sha256": "5135df712542c14c67575b86eb9000fd8e35b4c8a82103c032eb574f9a638775",
    "sizeBytes": 612
  },
  "limitations": [],
  "runId": "01J00000000000000000000015",
  "schemaVersion": "1.1",
  "startedAt": "2026-01-01T00:00:00Z",
  "status": "no_findings",
  "versions": {
    "core": "0.1.0",
    "detectors": [
      {
        "id": "pdf.actions",
        "version": "1.0.0"
      },
      {
        "id": "pdf.annotations",
        "version": "1.0.0"
      },
      {
        "id": "pdf.embedded_files",
        "version": "1.0.0"
      },
      {
        "id": "pdf.form_fields",
        "version": "1.0.0"
      },
      {
        "id": "pdf.metadata",
        "version": "1.1.0"
      },
      {
        "id": "pdf.structure",
        "version": "1.0.0"
      },
      {
        "id": "pdf.text_layer",
        "version": "1.1.0"
      }
    ],
    "parsers": [
      {
        "id": "pdf.parser",
        "version": "1.0.0"
      }
    ]
  }
}
