{
  "coverage": {
    "completed": [
      "pdf.actions",
      "pdf.annotations",
      "pdf.embedded_files",
      "pdf.form_fields",
      "pdf.metadata",
      "pdf.structure",
      "pdf.text_layer"
    ],
    "failed": [],
    "skipped": []
  },
  "durationMs": 0,
  "findings": [
    {
      "category": "annotation",
      "certainty": "deterministic",
      "detector": {
        "id": "pdf.annotations",
        "version": "1.0.0"
      },
      "evidence": {
        "displayValue": "/***k",
        "maskPolicy": "text_keep_edges",
        "redacted": true
      },
      "group": "document_structure",
      "id": "finding-1",
      "location": {
        "kind": "pdf_annotation",
        "objectNumber": 6,
        "page": 1,
        "subtype": "Link"
      },
      "message": "annotation found in pdf_annotation",
      "remediation": {
        "supported": false,
        "unsupportedReason": "not_implemented"
      },
      "severity": "high"
    }
  ],
  "input": {
    "mediaType": "application/pdf",
    "path": "/fixtures/pdf/files/external-references.control.pdf",
    "sha256": "8d29209c7a5094d8dcb030dbf325d72b35aad73efb29fa9e03050c4d2fbd36a6",
    "sizeBytes": 743
  },
  "limitations": [],
  "runId": "01J00000000000000000000011",
  "schemaVersion": "1.1",
  "startedAt": "2026-01-01T00:00:00Z",
  "status": "review_required",
  "versions": {
    "core": "0.1.0",
    "detectors": [
      {
        "id": "pdf.actions",
        "version": "1.0.0"
      },
      {
        "id": "pdf.annotations",
        "version": "1.0.0"
      },
      {
        "id": "pdf.embedded_files",
        "version": "1.0.0"
      },
      {
        "id": "pdf.form_fields",
        "version": "1.0.0"
      },
      {
        "id": "pdf.metadata",
        "version": "1.1.0"
      },
      {
        "id": "pdf.structure",
        "version": "1.0.0"
      },
      {
        "id": "pdf.text_layer",
        "version": "1.1.0"
      }
    ],
    "parsers": [
      {
        "id": "pdf.parser",
        "version": "1.0.0"
      }
    ]
  }
}
