{
  "coverage": {
    "completed": [
      "pdf.actions",
      "pdf.annotations",
      "pdf.embedded_files",
      "pdf.form_fields",
      "pdf.metadata",
      "pdf.structure",
      "pdf.text_layer"
    ],
    "failed": [],
    "skipped": []
  },
  "durationMs": 0,
  "findings": [
    {
      "category": "text_under_redaction",
      "certainty": "deterministic",
      "detector": {
        "id": "pdf.text_layer",
        "version": "1.1.0"
      },
      "evidence": {
        "displayValue": "***********************",
        "maskPolicy": "fully_masked",
        "redacted": true
      },
      "group": "document_structure",
      "id": "finding-1",
      "location": {
        "kind": "pdf_text_layer",
        "page": 1
      },
      "message": "text_under_redaction found in pdf_text_layer",
      "remediation": {
        "supported": false,
        "unsupportedReason": "not_implemented"
      },
      "severity": "critical"
    }
  ],
  "input": {
    "mediaType": "application/pdf",
    "path": "/fixtures/pdf/files/text-under-cover.positive.pdf",
    "sha256": "cdb993d717dc43f7a4a601b234c5f60f017f2949e41ad48303c2bd42ee73c839",
    "sizeBytes": 632
  },
  "limitations": [],
  "runId": "01J00000000000000000000024",
  "schemaVersion": "1.1",
  "startedAt": "2026-01-01T00:00:00Z",
  "status": "blocking_findings",
  "versions": {
    "core": "0.1.0",
    "detectors": [
      {
        "id": "pdf.actions",
        "version": "1.0.0"
      },
      {
        "id": "pdf.annotations",
        "version": "1.0.0"
      },
      {
        "id": "pdf.embedded_files",
        "version": "1.0.0"
      },
      {
        "id": "pdf.form_fields",
        "version": "1.0.0"
      },
      {
        "id": "pdf.metadata",
        "version": "1.1.0"
      },
      {
        "id": "pdf.structure",
        "version": "1.0.0"
      },
      {
        "id": "pdf.text_layer",
        "version": "1.1.0"
      }
    ],
    "parsers": [
      {
        "id": "pdf.parser",
        "version": "1.0.0"
      }
    ]
  }
}
