{
  "coverage": {
    "completed": [
      "pdf.actions",
      "pdf.annotations",
      "pdf.embedded_files",
      "pdf.form_fields",
      "pdf.metadata",
      "pdf.structure",
      "pdf.text_layer"
    ],
    "failed": [],
    "skipped": []
  },
  "durationMs": 0,
  "findings": [
    {
      "category": "form_field_name",
      "certainty": "deterministic",
      "detector": {
        "id": "pdf.form_fields",
        "version": "1.0.0"
      },
      "evidence": {
        "displayValue": "S***1",
        "maskPolicy": "text_keep_edges",
        "redacted": true
      },
      "group": "document_structure",
      "id": "finding-1",
      "location": {
        "fieldName": "S***1",
        "kind": "pdf_form_field"
      },
      "message": "form_field_name found in pdf_form_field",
      "remediation": {
        "supported": false,
        "unsupportedReason": "not_implemented"
      },
      "severity": "low"
    },
    {
      "category": "digital_signature",
      "certainty": "deterministic",
      "detector": {
        "id": "pdf.structure",
        "version": "1.0.0"
      },
      "evidence": {
        "displayValue": "a signature dictionary is present",
        "maskPolicy": "structural_label",
        "redacted": false
      },
      "group": "document_structure",
      "id": "finding-2",
      "location": {
        "detail": "signature_dictionary",
        "kind": "file_structure"
      },
      "message": "digital_signature found in file_structure",
      "remediation": {
        "supported": false,
        "unsupportedReason": "not_implemented"
      },
      "severity": "low"
    }
  ],
  "input": {
    "mediaType": "application/pdf",
    "path": "/fixtures/pdf/files/digital-signature.positive.pdf",
    "sha256": "6e5d711b6bad68573232af2e857d5ecf64a87decd8b7d4803e5b311c94c8143c",
    "sizeBytes": 869
  },
  "limitations": [],
  "runId": "01J00000000000000000000004",
  "schemaVersion": "1.1",
  "startedAt": "2026-01-01T00:00:00Z",
  "status": "review_required",
  "versions": {
    "core": "0.1.0",
    "detectors": [
      {
        "id": "pdf.actions",
        "version": "1.0.0"
      },
      {
        "id": "pdf.annotations",
        "version": "1.0.0"
      },
      {
        "id": "pdf.embedded_files",
        "version": "1.0.0"
      },
      {
        "id": "pdf.form_fields",
        "version": "1.0.0"
      },
      {
        "id": "pdf.metadata",
        "version": "1.1.0"
      },
      {
        "id": "pdf.structure",
        "version": "1.0.0"
      },
      {
        "id": "pdf.text_layer",
        "version": "1.1.0"
      }
    ],
    "parsers": [
      {
        "id": "pdf.parser",
        "version": "1.0.0"
      }
    ]
  }
}
