{
  "coverage": {
    "completed": [
      "pdf.actions",
      "pdf.annotations",
      "pdf.embedded_files",
      "pdf.form_fields",
      "pdf.metadata",
      "pdf.structure",
      "pdf.text_layer"
    ],
    "failed": [],
    "skipped": []
  },
  "durationMs": 0,
  "findings": [
    {
      "category": "document_title",
      "certainty": "deterministic",
      "detector": {
        "id": "pdf.metadata",
        "version": "1.1.0"
      },
      "evidence": {
        "displayValue": "P***n",
        "maskPolicy": "text_keep_edges",
        "redacted": true
      },
      "group": "document_structure",
      "id": "finding-1",
      "location": {
        "field": "Title",
        "kind": "pdf_metadata"
      },
      "message": "document_title found in pdf_metadata",
      "remediation": {
        "supported": false,
        "unsupportedReason": "not_implemented"
      },
      "severity": "low"
    }
  ],
  "input": {
    "mediaType": "application/pdf",
    "path": "/fixtures/pdf/files/incremental-update.control.pdf",
    "sha256": "58838cb82b26916f04235c2da08f24c552b98b934f82ccf058f07dd7b7386441",
    "sizeBytes": 678
  },
  "limitations": [],
  "runId": "01J00000000000000000000017",
  "schemaVersion": "1.1",
  "startedAt": "2026-01-01T00:00:00Z",
  "status": "review_required",
  "versions": {
    "core": "0.1.0",
    "detectors": [
      {
        "id": "pdf.actions",
        "version": "1.0.0"
      },
      {
        "id": "pdf.annotations",
        "version": "1.0.0"
      },
      {
        "id": "pdf.embedded_files",
        "version": "1.0.0"
      },
      {
        "id": "pdf.form_fields",
        "version": "1.0.0"
      },
      {
        "id": "pdf.metadata",
        "version": "1.1.0"
      },
      {
        "id": "pdf.structure",
        "version": "1.0.0"
      },
      {
        "id": "pdf.text_layer",
        "version": "1.1.0"
      }
    ],
    "parsers": [
      {
        "id": "pdf.parser",
        "version": "1.0.0"
      }
    ]
  }
}
