{
  "coverage": {
    "completed": [
      "pdf.actions",
      "pdf.annotations",
      "pdf.embedded_files",
      "pdf.form_fields",
      "pdf.metadata",
      "pdf.structure",
      "pdf.text_layer"
    ],
    "failed": [],
    "skipped": []
  },
  "durationMs": 0,
  "findings": [
    {
      "category": "document_javascript",
      "certainty": "deterministic",
      "detector": {
        "id": "pdf.actions",
        "version": "1.0.0"
      },
      "evidence": {
        "displayValue": "*************************************",
        "maskPolicy": "fully_masked",
        "redacted": true
      },
      "group": "document_structure",
      "id": "finding-1",
      "location": {
        "kind": "pdf_action",
        "objectNumber": 1,
        "trigger": "named_action"
      },
      "message": "document_javascript found in pdf_action",
      "remediation": {
        "supported": false,
        "unsupportedReason": "not_implemented"
      },
      "severity": "high"
    },
    {
      "category": "document_javascript",
      "certainty": "deterministic",
      "detector": {
        "id": "pdf.actions",
        "version": "1.0.0"
      },
      "evidence": {
        "displayValue": "**************************",
        "maskPolicy": "fully_masked",
        "redacted": true
      },
      "group": "document_structure",
      "id": "finding-2",
      "location": {
        "kind": "pdf_action",
        "objectNumber": 6,
        "trigger": "named_action"
      },
      "message": "document_javascript found in pdf_action",
      "remediation": {
        "supported": false,
        "unsupportedReason": "not_implemented"
      },
      "severity": "high"
    },
    {
      "category": "launch_action",
      "certainty": "deterministic",
      "detector": {
        "id": "pdf.actions",
        "version": "1.0.0"
      },
      "evidence": {
        "displayValue": "/***p",
        "maskPolicy": "text_keep_edges",
        "redacted": true
      },
      "group": "document_structure",
      "id": "finding-3",
      "location": {
        "kind": "pdf_action",
        "objectNumber": 7,
        "trigger": "document_open"
      },
      "message": "launch_action found in pdf_action",
      "remediation": {
        "supported": false,
        "unsupportedReason": "not_implemented"
      },
      "severity": "high"
    }
  ],
  "input": {
    "mediaType": "application/pdf",
    "path": "/fixtures/pdf/files/javascript-and-launch.positive.pdf",
    "sha256": "163fbe343568eb6833338bf334c3973211fd3a9fb0760503c95019fed8340f76",
    "sizeBytes": 856
  },
  "limitations": [],
  "runId": "01J00000000000000000000022",
  "schemaVersion": "1.1",
  "startedAt": "2026-01-01T00:00:00Z",
  "status": "review_required",
  "versions": {
    "core": "0.1.0",
    "detectors": [
      {
        "id": "pdf.actions",
        "version": "1.0.0"
      },
      {
        "id": "pdf.annotations",
        "version": "1.0.0"
      },
      {
        "id": "pdf.embedded_files",
        "version": "1.0.0"
      },
      {
        "id": "pdf.form_fields",
        "version": "1.0.0"
      },
      {
        "id": "pdf.metadata",
        "version": "1.1.0"
      },
      {
        "id": "pdf.structure",
        "version": "1.0.0"
      },
      {
        "id": "pdf.text_layer",
        "version": "1.1.0"
      }
    ],
    "parsers": [
      {
        "id": "pdf.parser",
        "version": "1.0.0"
      }
    ]
  }
}
