{
  "coverage": {
    "completed": [
      "pdf.actions",
      "pdf.annotations",
      "pdf.embedded_files",
      "pdf.form_fields",
      "pdf.metadata",
      "pdf.structure",
      "pdf.text_layer"
    ],
    "failed": [],
    "skipped": [
      {
        "detector": "ocr.visible_text",
        "message": "local OCR is not implemented yet (#6), so text that exists only inside images was not read",
        "reason": "dependency_unavailable"
      }
    ]
  },
  "durationMs": 0,
  "findings": [],
  "input": {
    "mediaType": "application/pdf",
    "path": "/fixtures/pdf/files/image-only-page.positive.pdf",
    "sha256": "a4d4cdc70829dd57617ffabe0084d84966428bff55c95134b27bdfea03538b4d",
    "sizeBytes": 773
  },
  "limitations": [
    {
      "affectedDetectors": [
        "ocr.visible_text"
      ],
      "code": "ocr_not_available",
      "impact": "coverage_incomplete",
      "message": "this build has no local OCR, so text that exists only inside an image was not read"
    }
  ],
  "runId": "01J00000000000000000000016",
  "schemaVersion": "1.1",
  "startedAt": "2026-01-01T00:00:00Z",
  "status": "partial",
  "versions": {
    "core": "0.1.0",
    "detectors": [
      {
        "id": "ocr.visible_text",
        "version": "0.4.1"
      },
      {
        "id": "pdf.actions",
        "version": "1.0.0"
      },
      {
        "id": "pdf.annotations",
        "version": "1.0.0"
      },
      {
        "id": "pdf.embedded_files",
        "version": "1.0.0"
      },
      {
        "id": "pdf.form_fields",
        "version": "1.0.0"
      },
      {
        "id": "pdf.metadata",
        "version": "1.1.0"
      },
      {
        "id": "pdf.structure",
        "version": "1.0.0"
      },
      {
        "id": "pdf.text_layer",
        "version": "1.1.0"
      }
    ],
    "parsers": [
      {
        "id": "pdf.parser",
        "version": "1.0.0"
      }
    ]
  }
}
