{
  "coverage": {
    "completed": [
      "pdf.actions",
      "pdf.annotations",
      "pdf.embedded_files",
      "pdf.form_fields",
      "pdf.metadata",
      "pdf.structure",
      "pdf.text_layer"
    ],
    "failed": [],
    "skipped": []
  },
  "durationMs": 0,
  "findings": [
    {
      "category": "form_field_name",
      "certainty": "deterministic",
      "detector": {
        "id": "pdf.form_fields",
        "version": "1.0.0"
      },
      "evidence": {
        "displayValue": "a***d",
        "maskPolicy": "text_keep_edges",
        "redacted": true
      },
      "group": "document_structure",
      "id": "finding-1",
      "location": {
        "fieldName": "a***d",
        "kind": "pdf_form_field"
      },
      "message": "form_field_name found in pdf_form_field",
      "remediation": {
        "supported": false,
        "unsupportedReason": "not_implemented"
      },
      "severity": "low"
    },
    {
      "category": "form_field_value",
      "certainty": "deterministic",
      "detector": {
        "id": "pdf.form_fields",
        "version": "1.0.0"
      },
      "evidence": {
        "displayValue": "***********",
        "maskPolicy": "fully_masked",
        "redacted": true
      },
      "group": "document_structure",
      "id": "finding-2",
      "location": {
        "fieldName": "a***d",
        "kind": "pdf_form_field"
      },
      "message": "form_field_value found in pdf_form_field",
      "remediation": {
        "supported": false,
        "unsupportedReason": "not_implemented"
      },
      "severity": "high"
    }
  ],
  "input": {
    "mediaType": "application/pdf",
    "path": "/fixtures/pdf/files/form-fields.positive.pdf",
    "sha256": "63609efc4703da03a373acb4e92df33050974782cbaa35d193f1a04d29619f72",
    "sizeBytes": 726
  },
  "limitations": [],
  "runId": "01J00000000000000000000014",
  "schemaVersion": "1.1",
  "startedAt": "2026-01-01T00:00:00Z",
  "status": "review_required",
  "versions": {
    "core": "0.1.0",
    "detectors": [
      {
        "id": "pdf.actions",
        "version": "1.0.0"
      },
      {
        "id": "pdf.annotations",
        "version": "1.0.0"
      },
      {
        "id": "pdf.embedded_files",
        "version": "1.0.0"
      },
      {
        "id": "pdf.form_fields",
        "version": "1.0.0"
      },
      {
        "id": "pdf.metadata",
        "version": "1.1.0"
      },
      {
        "id": "pdf.structure",
        "version": "1.0.0"
      },
      {
        "id": "pdf.text_layer",
        "version": "1.1.0"
      }
    ],
    "parsers": [
      {
        "id": "pdf.parser",
        "version": "1.0.0"
      }
    ]
  }
}
