{
  "coverage": {
    "completed": [
      "pdf.actions",
      "pdf.annotations",
      "pdf.embedded_files",
      "pdf.form_fields",
      "pdf.metadata",
      "pdf.structure",
      "pdf.text_layer"
    ],
    "failed": [],
    "skipped": []
  },
  "durationMs": 0,
  "findings": [
    {
      "category": "annotation",
      "certainty": "deterministic",
      "detector": {
        "id": "pdf.annotations",
        "version": "1.0.0"
      },
      "evidence": {
        "displayValue": "/***k",
        "maskPolicy": "text_keep_edges",
        "redacted": true
      },
      "group": "document_structure",
      "id": "finding-1",
      "location": {
        "kind": "pdf_annotation",
        "objectNumber": 6,
        "page": 1,
        "subtype": "Link"
      },
      "message": "annotation found in pdf_annotation",
      "remediation": {
        "supported": false,
        "unsupportedReason": "not_implemented"
      },
      "severity": "high"
    },
    {
      "category": "annotation",
      "certainty": "deterministic",
      "detector": {
        "id": "pdf.annotations",
        "version": "1.0.0"
      },
      "evidence": {
        "displayValue": "/***k",
        "maskPolicy": "text_keep_edges",
        "redacted": true
      },
      "group": "document_structure",
      "id": "finding-2",
      "location": {
        "kind": "pdf_annotation",
        "objectNumber": 7,
        "page": 1,
        "subtype": "Link"
      },
      "message": "annotation found in pdf_annotation",
      "remediation": {
        "supported": false,
        "unsupportedReason": "not_implemented"
      },
      "severity": "high"
    },
    {
      "category": "external_reference",
      "certainty": "deterministic",
      "detector": {
        "id": "pdf.actions",
        "version": "1.0.0"
      },
      "evidence": {
        "displayValue": "ht***st",
        "maskPolicy": "token_keep_edges",
        "redacted": true
      },
      "group": "document_structure",
      "id": "finding-3",
      "location": {
        "kind": "pdf_action",
        "objectNumber": 6,
        "trigger": "annotation"
      },
      "message": "external_reference found in pdf_action",
      "remediation": {
        "supported": false,
        "unsupportedReason": "not_implemented"
      },
      "severity": "medium"
    },
    {
      "category": "local_file_reference",
      "certainty": "deterministic",
      "detector": {
        "id": "pdf.actions",
        "version": "1.0.0"
      },
      "evidence": {
        "displayValue": "/***x",
        "maskPolicy": "text_keep_edges",
        "redacted": true
      },
      "group": "document_structure",
      "id": "finding-4",
      "location": {
        "kind": "pdf_action",
        "objectNumber": 7,
        "trigger": "annotation"
      },
      "message": "local_file_reference found in pdf_action",
      "remediation": {
        "supported": false,
        "unsupportedReason": "not_implemented"
      },
      "severity": "high"
    }
  ],
  "input": {
    "mediaType": "application/pdf",
    "path": "/fixtures/pdf/files/external-references.positive.pdf",
    "sha256": "9c8995ba211a11d463f96188bfb15f5d73d6bf9188b9677393c5608c7dd471c1",
    "sizeBytes": 960
  },
  "limitations": [],
  "runId": "01J00000000000000000000012",
  "schemaVersion": "1.1",
  "startedAt": "2026-01-01T00:00:00Z",
  "status": "review_required",
  "versions": {
    "core": "0.1.0",
    "detectors": [
      {
        "id": "pdf.actions",
        "version": "1.0.0"
      },
      {
        "id": "pdf.annotations",
        "version": "1.0.0"
      },
      {
        "id": "pdf.embedded_files",
        "version": "1.0.0"
      },
      {
        "id": "pdf.form_fields",
        "version": "1.0.0"
      },
      {
        "id": "pdf.metadata",
        "version": "1.1.0"
      },
      {
        "id": "pdf.structure",
        "version": "1.0.0"
      },
      {
        "id": "pdf.text_layer",
        "version": "1.1.0"
      }
    ],
    "parsers": [
      {
        "id": "pdf.parser",
        "version": "1.0.0"
      }
    ]
  }
}
